{
  "$schema": "https://json-schema.org/draft/2020-12/schema",
  "$id": "optiondesk/strategy_plan/v1",
  "title": "Option strategy plan",
  "description": "One multi-leg strategy built from a chain snapshot: the legs, the expiry risk graph, model probabilities under a lognormal settlement assumption, the net position Greeks, an estimate of round-trip friction at the quoted spreads, and the payoff curve for plotting. Premiums are model and mid-quote values. Nothing here is an executable price, an order, or a recommendation.",
  "type": "object",
  "required": [
    "meta",
    "strategy",
    "trade_type",
    "underlying",
    "spot",
    "legs",
    "analysis",
    "payoff_curve"
  ],
  "properties": {
    "meta": {
      "$ref": "#/$defs/meta"
    },
    "source_artifact": {
      "type": [
        "string",
        "null"
      ]
    },
    "strategy": {
      "type": "string"
    },
    "trade_type": {
      "type": "string",
      "enum": [
        "debit",
        "credit"
      ]
    },
    "underlying": {
      "type": "string"
    },
    "spot": {
      "type": "number",
      "exclusiveMinimum": 0
    },
    "expiry": {
      "type": [
        "string",
        "null"
      ]
    },
    "days_to_expiry": {
      "type": [
        "number",
        "null"
      ]
    },
    "size": {
      "type": "number",
      "exclusiveMinimum": 0
    },
    "outlooks": {
      "type": "array",
      "items": {
        "type": "integer"
      }
    },
    "outlook_labels": {
      "type": "array",
      "items": {
        "type": "string"
      }
    },
    "when_to_use": {
      "type": "string"
    },
    "band": {
      "type": [
        "array",
        "null"
      ],
      "description": "Lower and upper edge of the one standard deviation expected move, or null when no implied volatility was available to build it.",
      "items": {
        "type": "number"
      }
    },
    "legs": {
      "type": "array",
      "items": {
        "$ref": "#/$defs/leg"
      }
    },
    "analysis": {
      "$ref": "#/$defs/analysis",
      "properties": {
        "max_gain_on_boundary": {
          "type": [
            "boolean",
            "null"
          ],
          "description": "True when the maximum gain sits on the edge of the scanned range, so it is bounded by the window rather than by the structure and grows as the window widens."
        },
        "max_loss_on_boundary": {
          "type": [
            "boolean",
            "null"
          ],
          "description": "The same for the maximum loss."
        },
        "reward_risk_bounded_by_scan": {
          "type": [
            "boolean",
            "null"
          ],
          "description": "True when either extremum is on the boundary, in which case reward_risk is a property of the scan width. Measured on one live pair: 1.47 at span 0.10, 4.90 at span 0.40, 12.02 at span 1.00."
        },
        "scan_range_sd": {
          "type": [
            "array",
            "null"
          ],
          "description": "How far the scan reaches below and above spot, in standard deviations of the underlying over the time to the mark, from the legs' own volatilities. An extremum at minus eleven sd is arithmetic, not a scenario."
        }
      }
    },
    "probability": {
      "$ref": "#/$defs/probability"
    },
    "net_greeks": {
      "type": [
        "object",
        "null"
      ],
      "description": "Position Greeks, netted across option legs with sign and quantity. Units match the Greek ladder artifact. For a two-expiry structure each leg is priced at its own expiry and its own implied volatility, which is what lets a calendar read as long vega and collecting decay rather than as flat."
    },
    "friction": {
      "$ref": "#/$defs/friction"
    },
    "payoff_curve": {
      "type": "object",
      "required": [
        "prices",
        "pnl"
      ],
      "properties": {
        "prices": {
          "type": "array",
          "items": {
            "type": "number"
          }
        },
        "pnl": {
          "type": "array",
          "items": {
            "type": "number"
          }
        }
      }
    },
    "delta_ratio": {
      "type": [
        "number",
        "null"
      ],
      "description": "Short delta mass divided by long delta mass at entry, for a ratio structure. It is a bound on the split at entry and nothing more: it does not by itself keep a large move uncapped, and a structure satisfying it can still be net short. What keeps the move uncapped is holding more back-month contracts than front-month ones, which the builder checks first."
    },
    "long_delta": {
      "type": [
        "number",
        "null"
      ],
      "description": "Absolute delta of the back-month long leg as selected."
    },
    "short_delta": {
      "type": [
        "number",
        "null"
      ],
      "description": "Absolute delta of the front-month short leg."
    },
    "giveback": {
      "type": [
        "number",
        "null"
      ],
      "description": "Profit handed back from the peak at the far end of the scanned range, in the structure's own direction. The number that separates a ratio diagonal from a 1x1."
    },
    "risk_free_rate": {
      "type": [
        "number",
        "null"
      ],
      "description": "The rate the legs were selected and priced at, read off the chain snapshot rather than assumed."
    },
    "dividend_yield": {
      "type": [
        "number",
        "null"
      ],
      "description": "The continuous dividend yield used, read off the chain snapshot rather than assumed to be zero."
    }
  },
  "$defs": {
    "leg": {
      "type": "object",
      "required": [
        "kind",
        "side",
        "price",
        "qty"
      ],
      "properties": {
        "kind": {
          "type": "string",
          "enum": [
            "call",
            "put",
            "underlying"
          ]
        },
        "side": {
          "type": "string",
          "enum": [
            "long",
            "short"
          ]
        },
        "strike": {
          "type": [
            "number",
            "null"
          ]
        },
        "price": {
          "type": "number"
        },
        "qty": {
          "type": "number"
        },
        "symbol": {
          "type": [
            "string",
            "null"
          ]
        },
        "bid": {
          "type": [
            "number",
            "null"
          ]
        },
        "ask": {
          "type": [
            "number",
            "null"
          ]
        },
        "iv": {
          "type": [
            "number",
            "null"
          ]
        },
        "open_interest": {
          "type": [
            "integer",
            "null"
          ]
        },
        "volume": {
          "type": [
            "integer",
            "null"
          ]
        }
      }
    },
    "analysis": {
      "type": "object",
      "required": [
        "net_cash",
        "trade_type",
        "breakevens"
      ],
      "properties": {
        "net_cash": {
          "type": "number",
          "description": "Positive is a credit received, negative a debit paid. Option legs only."
        },
        "trade_type": {
          "type": "string",
          "enum": [
            "debit",
            "credit"
          ]
        },
        "breakevens": {
          "type": "array",
          "items": {
            "type": "number"
          }
        },
        "max_gain": {
          "type": [
            "number",
            "string"
          ],
          "description": "A number, or the string unlimited where the position is genuinely unbounded. JSON has no infinity, and rounding an unbounded risk to a comfortable number would be a lie."
        },
        "max_loss": {
          "type": [
            "number",
            "string"
          ]
        },
        "reward_risk": {
          "type": [
            "number",
            "null"
          ]
        }
      }
    },
    "probability": {
      "type": [
        "object",
        "null"
      ],
      "description": "Model estimates under a lognormal settlement distribution built from current implied volatility, with no directional drift. Not a forecast and not an observed win rate. For a two-expiry structure the settlement is the near expiry, the far leg is marked at the volatility it carries today, and the figures are numerical integrals of the marking curve rather than closed form; the model field says which.",
      "properties": {
        "profit": {
          "type": [
            "number",
            "null"
          ],
          "minimum": 0,
          "maximum": 1
        },
        "loss": {
          "type": [
            "number",
            "null"
          ],
          "minimum": 0,
          "maximum": 1
        },
        "expected_pnl": {
          "type": [
            "number",
            "null"
          ]
        },
        "expected_loss": {
          "type": [
            "number",
            "null"
          ]
        },
        "model": {
          "type": "string"
        }
      }
    },
    "friction": {
      "type": [
        "object",
        "null"
      ],
      "properties": {
        "verdict": {
          "type": "string",
          "enum": [
            "ok",
            "thin",
            "untradeable",
            "unknown"
          ]
        },
        "reason": {
          "type": "string"
        },
        "round_trip": {
          "type": [
            "number",
            "null"
          ]
        },
        "entry_cost": {
          "type": [
            "number",
            "null"
          ]
        },
        "rel_to_premium": {
          "type": [
            "number",
            "null"
          ]
        },
        "worst_rel_spread": {
          "type": [
            "number",
            "null"
          ]
        },
        "legs_without_quotes": {
          "type": "integer"
        },
        "depth_flags": {
          "type": "array",
          "items": {
            "type": "string"
          }
        }
      }
    },
    "meta": {
      "type": "object",
      "required": [
        "schema",
        "generated_utc",
        "tool",
        "provider_used",
        "degraded",
        "disclaimer"
      ],
      "properties": {
        "schema": {
          "type": "string"
        },
        "generated_utc": {
          "type": "string"
        },
        "tool": {
          "type": "string"
        },
        "shell_version": {
          "type": [
            "string",
            "null"
          ]
        },
        "engine_version": {
          "type": [
            "string",
            "null"
          ]
        },
        "provider_used": {
          "type": [
            "string",
            "null"
          ]
        },
        "degraded": {
          "type": "boolean"
        },
        "degraded_reason": {
          "type": [
            "string",
            "null"
          ]
        },
        "notes": {
          "type": "array",
          "items": {
            "type": "string"
          },
          "description": "Ordinary observations that are not defects, such as how many contracts carried no quotes. Never used for degradation."
        },
        "inputs": {
          "type": "object"
        },
        "disclaimer": {
          "type": "string"
        },
        "license": {
          "type": "string"
        }
      }
    }
  }
}
