{
 "meta": {
  "schema": "optiondesk/strategy_plan/v1",
  "generated_utc": "2026-09-08T22:15:38+00:00",
  "tool": "optiondesk strategy",
  "shell_version": "0.3.0",
  "engine_version": "0.3.0",
  "provider_used": "user snapshot",
  "degraded": false,
  "degraded_reason": null,
  "notes": [
   "Synthetic teaching inputs. No observed quotes, holdings, or price history. Not market-performance evidence.",
   "row 1: calculated mid from bid and ask",
   "row 2: calculated mid from bid and ask",
   "row 3: calculated mid from bid and ask",
   "row 4: calculated mid from bid and ask",
   "row 5: calculated mid from bid and ask",
   "row 6: calculated mid from bid and ask",
   "row 7: calculated mid from bid and ask",
   "row 8: calculated mid from bid and ask",
   "row 9: calculated mid from bid and ask",
   "row 10: calculated mid from bid and ask",
   "row 11: calculated mid from bid and ask",
   "row 12: calculated mid from bid and ask",
   "row 13: calculated mid from bid and ask",
   "row 14: calculated mid from bid and ask",
   "row 15: calculated mid from bid and ask",
   "row 16: calculated mid from bid and ask",
   "row 17: calculated mid from bid and ask",
   "row 18: calculated mid from bid and ask",
   "row 19: calculated mid from bid and ask",
   "row 20: calculated mid from bid and ask",
   "row 21: calculated mid from bid and ask",
   "row 22: calculated mid from bid and ask",
   "row 23: calculated mid from bid and ask",
   "row 24: calculated mid from bid and ask",
   "row 25: calculated mid from bid and ask",
   "row 26: calculated mid from bid and ask",
   "row 27: calculated mid from bid and ask",
   "row 28: calculated mid from bid and ask",
   "row 29: calculated mid from bid and ask",
   "row 30: calculated mid from bid and ask",
   "row 31: calculated mid from bid and ask",
   "row 32: calculated mid from bid and ask",
   "row 33: calculated mid from bid and ask",
   "row 34: calculated mid from bid and ask",
   "row 35: calculated mid from bid and ask",
   "row 36: calculated mid from bid and ask",
   "row 37: calculated mid from bid and ask",
   "row 38: calculated mid from bid and ask",
   "row 39: calculated mid from bid and ask",
   "row 40: calculated mid from bid and ask",
   "row 41: calculated mid from bid and ask",
   "row 42: calculated mid from bid and ask",
   "row 43: calculated mid from bid and ask",
   "row 44: calculated mid from bid and ask",
   "row 45: calculated mid from bid and ask",
   "row 46: calculated mid from bid and ask",
   "row 47: calculated mid from bid and ask",
   "row 48: calculated mid from bid and ask",
   "row 49: calculated mid from bid and ask",
   "row 50: calculated mid from bid and ask",
   "row 51: calculated mid from bid and ask",
   "row 52: calculated mid from bid and ask",
   "row 53: calculated mid from bid and ask",
   "row 54: calculated mid from bid and ask",
   "row 55: calculated mid from bid and ask",
   "row 56: calculated mid from bid and ask",
   "row 57: calculated mid from bid and ask",
   "row 58: calculated mid from bid and ask",
   "row 59: calculated mid from bid and ask",
   "row 60: calculated mid from bid and ask",
   "row 61: calculated mid from bid and ask",
   "row 62: calculated mid from bid and ask"
  ],
  "inputs": {
   "strategy": "long_put",
   "snapshot": "examples/dashboard/chain_SYNTH_2026-10-08.json",
   "size": 1.0
  },
  "disclaimer": "Research output, not investment advice, and not a recommendation or solicitation. Option premiums here are theoretical model values, not quotes and not achievable fills. Market data is third-party, may be delayed or wrong, and its redistribution is governed by the provider's terms. No warranty. See DISCLAIMER.md.",
  "license": "Produced by optiondesk under the PolyForm Noncommercial License 1.0.0. Noncommercial use is permitted; commercial use requires a separate written agreement with the copyright holder. See LICENSE and LICENSES.md."
 },
 "source_artifact": "examples/dashboard/chain_SYNTH_2026-10-08.json",
 "strategy": "long_put",
 "trade_type": "debit",
 "underlying": "SYNTH",
 "spot": 100.0,
 "expiry": "2026-10-08",
 "days_to_expiry": 30.0,
 "size": 1.0,
 "outlooks": [
  -2
 ],
 "outlook_labels": [
  "strong bearish (-2)"
 ],
 "when_to_use": "Alternative to shorting: profits from the fall with risk capped at the premium.",
 "band": [
  92.54603167194705,
  107.45396832805295
 ],
 "legs": [
  {
   "kind": "put",
   "side": "long",
   "strike": 100.0,
   "price": 2.8455019999999998,
   "qty": 1.0,
   "symbol": "SYNTHP100",
   "bid": 2.760137,
   "ask": 2.930867,
   "iv": 0.26,
   "open_interest": 671,
   "volume": 550
  }
 ],
 "analysis": {
  "net_cash": -2.8455019999999998,
  "trade_type": "debit",
  "breakevens": [
   97.154498
  ],
  "max_gain": 97.154498,
  "max_loss": -2.8455019999999998,
  "reward_risk": 34.14318387405808,
  "risk_free": false
 },
 "probability": {
  "profit": 0.36316562178498835,
  "loss": 0.6368343782150117,
  "expected_pnl": 0.12751283360818388,
  "expected_loss": -2.508359233249858,
  "model": "lognormal settlement at the at-the-money implied volatility of 0.2600, no drift"
 },
 "net_greeks": {
  "delta": -0.471569958381,
  "gamma": 0.053344652798187,
  "vega": 11.399679228105715,
  "theta": -0.04521085666528341,
  "rho": -4.109794358917324,
  "vanna": 0.006408103708106793,
  "vomma": -0.012924247099385033,
  "charm": -0.0004791373753699358,
  "legs_priced": 1,
  "legs_skipped_without_iv": 0,
  "complete": true
 },
 "friction": {
  "round_trip": 0.08536500000000014,
  "entry_cost": 0.04268250000000007,
  "rel_to_premium": 0.029999978914089724,
  "worst_rel_spread": 0.05999995782817945,
  "legs_without_quotes": 0,
  "depth_flags": [],
  "verdict": "ok",
  "reason": "round trip is 3.0 percent of the premium"
 },
 "payoff_curve": {
  "prices": [
   75.0,
   75.2092050209205,
   75.418410041841,
   75.6276150627615,
   75.83682008368201,
   76.0460251046025,
   76.25523012552301,
   76.46443514644352,
   76.67364016736401,
   76.88284518828452,
   77.09205020920503,
   77.30125523012552,
   77.51046025104603,
   77.71966527196653,
   77.92887029288703,
   78.13807531380753,
   78.34728033472803,
   78.55648535564853,
   78.76569037656904,
   78.97489539748953,
   79.18410041841004,
   79.39330543933055,
   79.60251046025104,
   79.81171548117155,
   80.02092050209205,
   80.23012552301255,
   80.43933054393305,
   80.64853556485356,
   80.85774058577405,
   81.06694560669456,
   81.27615062761507,
   81.48535564853556,
   81.69456066945607,
   81.90376569037657,
   82.11297071129707,
   82.32217573221757,
   82.53138075313808,
   82.74058577405857,
   82.94979079497908,
   83.15899581589959,
   83.36820083682008,
   83.57740585774059,
   83.7866108786611,
   83.99581589958159,
   84.2050209205021,
   84.41422594142259,
   84.6234309623431,
   84.8326359832636,
   85.0418410041841,
   85.2510460251046,
   85.4602510460251,
   85.6694560669456,
   85.8786610878661,
   86.08786610878661,
   86.29707112970712,
   86.50627615062761,
   86.71548117154812,
   86.92468619246861,
   87.13389121338912,
   87.34309623430963,
   87.55230125523012,
   87.76150627615063,
   87.97071129707113,
   88.17991631799163,
   88.38912133891213,
   88.59832635983264,
   88.80753138075313,
   89.01673640167364,
   89.22594142259415,
   89.43514644351464,
   89.64435146443515,
   89.85355648535565,
   90.06276150627615,
   90.27196652719665,
   90.48117154811715,
   90.69037656903765,
   90.89958158995816,
   91.10878661087867,
   91.31799163179916,
   91.52719665271967,
   91.73640167364016,
   91.94560669456067,
   92.15481171548117,
   92.36401673640168,
   92.57322175732217,
   92.78242677824268,
   92.99163179916317,
   93.20083682008368,
   93.41004184100419,
   93.6192468619247,
   93.82845188284519,
   94.0376569037657,
   94.24686192468619,
   94.4560669456067,
   94.6652719665272,
   94.8744769874477,
   95.0836820083682,
   95.2928870292887,
   95.5020920502092,
   95.7112970711297,
   95.92050209205021,
   96.1297071129707,
   96.33891213389121,
   96.5481171548117,
   96.75732217573221,
   96.96652719665272,
   97.17573221757323,
   97.38493723849372,
   97.59414225941423,
   97.80334728033472,
   98.01255230125523,
   98.22175732217573,
   98.43096234309624,
   98.64016736401673,
   98.84937238493724,
   99.05857740585773,
   99.26778242677824,
   99.47698744769875,
   99.68619246861925,
   99.89539748953975,
   100.0,
   100.10460251046025,
   100.31380753138075,
   100.52301255230125,
   100.73221757322176,
   100.94142259414227,
   101.15062761506276,
   101.35983263598327,
   101.56903765690376,
   101.77824267782427,
   101.98744769874477,
   102.19665271966527,
   102.40585774058577,
   102.61506276150627,
   102.82426778242677,
   103.03347280334728,
   103.24267782426779,
   103.45188284518828,
   103.66108786610879,
   103.87029288702928,
   104.07949790794979,
   104.2887029288703,
   104.4979079497908,
   104.7071129707113,
   104.9163179916318,
   105.12552301255229,
   105.3347280334728,
   105.5439330543933,
   105.75313807531381,
   105.9623430962343,
   106.17154811715481,
   106.3807531380753,
   106.58995815899581,
   106.79916317991632,
   107.00836820083683,
   107.21757322175732,
   107.42677824267781,
   107.63598326359832,
   107.84518828451883,
   108.05439330543933,
   108.26359832635984,
   108.47280334728033,
   108.68200836820083,
   108.89121338912133,
   109.10041841004184,
   109.30962343096235,
   109.51882845188285,
   109.72803347280335,
   109.93723849372384,
   110.14644351464435,
   110.35564853556485,
   110.56485355648536,
   110.77405857740585,
   110.98326359832636,
   111.19246861924685,
   111.40167364016736,
   111.61087866108787,
   111.82008368200837,
   112.02928870292887,
   112.23849372384937,
   112.44769874476987,
   112.65690376569037,
   112.86610878661088,
   113.07531380753139,
   113.28451882845188,
   113.49372384937239,
   113.70292887029288,
   113.91213389121339,
   114.1213389121339,
   114.3305439330544,